{
  "schema": "assetsstudio_style_profile_v1",
  "id": "western_fantasy_qstyle_soft3d_v1",
  "label": "西方奇幻 Q 版软 3D",
  "revision": 1,
  "status": "approved",
  "scope": ["character", "wearable", "prop"],
  "authorities": [
    {
      "id": "ratio_style_anchor",
      "path": "references/actor_v2/actor_v2_ratio_style_anchor_user_v1.png",
      "sha256": "ce589213993cff489e59789dc2ca28a32b3fabc6a51860bb4b73217baed756d6",
      "role": "primary_proportion",
      "required": true
    },
    {
      "id": "default_adventurer_identity",
      "path": "references/actor_v2/actor_v2_default_adventurer_turnaround_v1_candidate.png",
      "sha256": "b41409320f8b6c9faef3df17f5d0693b8a4971f3b221354428e2e9c377849f51",
      "role": "character_identity",
      "required": true
    },
    {
      "id": "local_reference_turnaround_evidence",
      "path": "docs/workflows/assets/flux2_klein_reference_adventurer_turnaround_4view_registered_20260823.png",
      "sha256": "daaa6e2046f998ce2e4a16ededfdb4285bc0199296a8048984df526b637a20c2",
      "role": "turnaround_evidence",
      "required": false
    }
  ],
  "proportions": {
    "measured_actor_height_m": 1.990555,
    "measured_head_height_m": 0.931863,
    "measured_total_heads": 2.136102,
    "target_total_heads_range": [2.1, 2.5],
    "silhouette": "moderate compact chibi; large rounded head, short sturdy limbs, small torso and readable hands/feet"
  },
  "shape_language": [
    "large simple rounded masses",
    "low-frequency silhouette before surface detail",
    "soft bevels and thick readable accessory shapes",
    "oversized expressive eyes with compact facial spacing",
    "avoid thin fragile straps and realistic micro-detail"
  ],
  "render_language": {
    "medium": "polished soft 3D Japanese-anime game figurine",
    "surface": "clean matte colors with restrained roughness variation",
    "lighting": "soft studio key and fill with subtle ambient occlusion",
    "linework": "no heavy outline; shape separation comes from value and occlusion",
    "detail_density": "low to medium; every detail must remain readable at game camera distance"
  },
  "palette": [
    { "role": "hair_chestnut", "color_srgb": "#6B4B3A" },
    { "role": "eye_blue", "color_srgb": "#2D78C4" },
    { "role": "jacket_blue", "color_srgb": "#3E6F9F" },
    { "role": "scarf_red", "color_srgb": "#A83D32" },
    { "role": "cloth_cream", "color_srgb": "#E8D3A4" },
    { "role": "leather_brown", "color_srgb": "#765133" },
    { "role": "cloth_olive", "color_srgb": "#626B3E" },
    { "role": "metal_brass", "color_srgb": "#B08A50" }
  ],
  "prompt_contract": {
    "positive": [
      "moderate compact chibi proportions around 2.1 to 2.5 heads tall",
      "polished soft 3D Japanese-anime game figurine",
      "smooth rounded low-frequency geometry and thick readable silhouettes",
      "clean matte material colors, soft studio light, subtle ambient occlusion",
      "western fantasy adventurer design language"
    ],
    "negative": [
      "realistic adult proportions or long slender limbs",
      "extreme one-and-a-half-head super deformed proportions",
      "photoreal skin, painterly brushwork, noisy micro-texture",
      "thin fragile straps, excessive ornaments, sharp high-frequency detail",
      "perspective distortion, action pose, dramatic lighting"
    ],
    "immutable_traits": [
      "rounded moderate-chibi silhouette",
      "soft 3D anime figurine material response",
      "low-frequency readable geometry",
      "shared semantic palette roles"
    ]
  },
  "qa": {
    "required_views": ["front", "right", "back", "left"],
    "checks": [
      "target total-head range",
      "silhouette readability at thumbnail size",
      "semantic palette continuity",
      "same material response across character and accessory",
      "no realism or detail-density drift"
    ],
    "human_review_required": true
  }
}
